{
  "schema_version": "1.0.0",
  "status": "frozen",
  "required_size": 50,
  "notes": "Frozen on 2026-04-23 with 51 research entries. The three is_example entries that previously seeded this file have been removed; a frozen corpus reads as one clean research artifact with no mixed example data. 12 of the 51 entries are classified as `ineligible-cherry-pick-required`; for those, version_bump_complexity is the complexity of the smallest qualifying upstream release path containing the fix (per axis-clarification in eval/INCLUSION_RULES.md dated 2026-04-23), NOT the complexity of the nixpkgs patch form actually used historically.",
  "axes": {
    "mapping_difficulty": [
      "easy",
      "medium",
      "ambiguous"
    ],
    "version_bump_complexity": [
      "patch-release",
      "point-release",
      "multi-release",
      "major-jump"
    ],
    "passthru_tests": [
      "yes",
      "minimal",
      "none"
    ],
    "reproducibility": [
      "straightforward",
      "config-sensitive",
      "DoS-shaped",
      "crypto-shaped",
      "parser-heavy",
      "kernel-adjacent",
      "impractical"
    ],
    "rebuild_closure_size": [
      "<50",
      "50-500",
      "500-5000",
      ">5000"
    ],
    "human_decision_difficulty": [
      "trivial",
      "routine",
      "contentious"
    ]
  },
  "entries": [
    {
      "cve_id": "CVE-2026-25949",
      "harvested_at": "2026-04-23T00:00:00Z",
      "nixpkgs_rev": "55b908383f4d5bfee96f5cca0effc66c80893984",
      "affected_attrs": [
        "traefik"
      ],
      "historical_fix": {
        "upstream_repo_url": "https://github.com/traefik/traefik",
        "upstream_tag_or_release": "v3.6.8",
        "nixpkgs_fix_commit_sha": "be6f65471a8dbd41e53a798930756ee8c78eace6"
      },
      "axes": {
        "mapping_difficulty": "easy",
        "version_bump_complexity": "patch-release",
        "passthru_tests": "yes",
        "reproducibility": "DoS-shaped",
        "rebuild_closure_size": "<50",
        "human_decision_difficulty": "trivial"
      },
      "expected_v0_eligibility": "auto-merge-eligible",
      "expected_bundle_kind": "auto-merge",
      "expected_upstream_ref_verdict": "eligible",
      "notes": "CWE-400 DoS via STARTTLS on Postgres; clean patch release v3.6.8; Go leaf binary, small rebuild blast radius.",
      "is_example": false
    },
    {
      "cve_id": "CVE-2026-1998",
      "harvested_at": "2026-04-23T00:00:00Z",
      "nixpkgs_rev": "329df397e371958cd9448470515099a7ae8436c4",
      "affected_attrs": [
        "micropython"
      ],
      "historical_fix": {
        "upstream_repo_url": "https://github.com/micropython/micropython",
        "upstream_tag_or_release": "v1.27.0",
        "nixpkgs_fix_commit_sha": "d7a51d1f8358"
      },
      "axes": {
        "mapping_difficulty": "easy",
        "version_bump_complexity": "point-release",
        "passthru_tests": "minimal",
        "reproducibility": "parser-heavy",
        "rebuild_closure_size": "<50",
        "human_decision_difficulty": "trivial"
      },
      "expected_v0_eligibility": "auto-merge-eligible",
      "expected_bundle_kind": "auto-merge",
      "expected_upstream_ref_verdict": "eligible",
      "notes": "CWE-119 memory corruption in py/runtime.c mp_import_all; minor version bump 1.26->1.27 with explicit CVE mention in the commit subject.",
      "is_example": false
    },
    {
      "cve_id": "CVE-2026-21722",
      "harvested_at": "2026-04-23T00:00:00Z",
      "nixpkgs_rev": "d87fc106f74596ab7cac8ee1876f44498f6c0058",
      "affected_attrs": [
        "grafana"
      ],
      "historical_fix": {
        "upstream_repo_url": "https://github.com/grafana/grafana",
        "upstream_tag_or_release": "v12.3.3",
        "nixpkgs_fix_commit_sha": "e43812ed394c"
      },
      "axes": {
        "mapping_difficulty": "easy",
        "version_bump_complexity": "patch-release",
        "passthru_tests": "minimal",
        "reproducibility": "config-sensitive",
        "rebuild_closure_size": "<50",
        "human_decision_difficulty": "trivial"
      },
      "expected_v0_eligibility": "auto-merge-eligible",
      "expected_bundle_kind": "auto-merge",
      "expected_upstream_ref_verdict": "eligible",
      "notes": "Public dashboards annotation time-range bypass; access-control bug; clean patch release; Go binary, leaf.",
      "is_example": false
    },
    {
      "cve_id": "CVE-2025-59681",
      "harvested_at": "2026-04-23T00:00:00Z",
      "nixpkgs_rev": "7cdf000040942331aaecadffc0785af2d08a9cbb",
      "affected_attrs": [
        "python3Packages.django_4"
      ],
      "historical_fix": {
        "upstream_repo_url": "https://github.com/django/django",
        "upstream_tag_or_release": "4.2.25",
        "nixpkgs_fix_commit_sha": "12db2344c7d6"
      },
      "axes": {
        "mapping_difficulty": "medium",
        "version_bump_complexity": "patch-release",
        "passthru_tests": "yes",
        "reproducibility": "parser-heavy",
        "rebuild_closure_size": "50-500",
        "human_decision_difficulty": "routine"
      },
      "expected_v0_eligibility": "auto-merge-eligible",
      "expected_bundle_kind": "auto-merge",
      "expected_upstream_ref_verdict": "eligible",
      "notes": "CWE-89 SQL injection in QuerySet.annotate/alias/aggregate/Q; django patch release 4.2.25; mapping medium because nixpkgs attr path is python3Packages.django_4 vs upstream CPE django:django.",
      "is_example": false
    },
    {
      "cve_id": "CVE-2026-2003",
      "harvested_at": "2026-04-23T00:00:00Z",
      "nixpkgs_rev": "fabe9a18bafec76d739e6fe7766fc71849ea5674",
      "affected_attrs": [
        "postgresql_14"
      ],
      "historical_fix": {
        "upstream_repo_url": "https://github.com/postgres/postgres",
        "upstream_tag_or_release": "REL_14_21",
        "nixpkgs_fix_commit_sha": "4fa12916ebb6"
      },
      "axes": {
        "mapping_difficulty": "easy",
        "version_bump_complexity": "patch-release",
        "passthru_tests": "yes",
        "reproducibility": "parser-heavy",
        "rebuild_closure_size": "500-5000",
        "human_decision_difficulty": "routine"
      },
      "expected_v0_eligibility": "requires-human-review",
      "expected_bundle_kind": "human-review-required",
      "expected_upstream_ref_verdict": "eligible",
      "notes": "CWE-1287 oidvector memory disclosure; clean patch release 14.20->14.21 with 4 co-fixed CVEs in release notes; upstream-ref itself is eligible, but bundle.kind goes to human-review-required because reverse-closure exceeds v0 blast-radius threshold (500). kind_reason: blast-radius-exceeds-threshold.",
      "is_example": false
    },
    {
      "cve_id": "CVE-2025-9230",
      "harvested_at": "2026-04-23T00:00:00Z",
      "nixpkgs_rev": "1453647d2294bdaa8942aa9ace7256ff4fa230af",
      "affected_attrs": [
        "openssl_3"
      ],
      "historical_fix": {
        "upstream_repo_url": "https://github.com/openssl/openssl",
        "upstream_tag_or_release": "openssl-3.0.18",
        "nixpkgs_fix_commit_sha": "9e4cf668a33a"
      },
      "axes": {
        "mapping_difficulty": "easy",
        "version_bump_complexity": "patch-release",
        "passthru_tests": "yes",
        "reproducibility": "crypto-shaped",
        "rebuild_closure_size": ">5000",
        "human_decision_difficulty": "contentious"
      },
      "expected_v0_eligibility": "requires-human-review",
      "expected_bundle_kind": "human-review-required",
      "expected_upstream_ref_verdict": "eligible",
      "notes": "CWE-125/787 OOB r/w in RFC 3211 KEK unwrap; clean 3.0.17->3.0.18 patch release on the LTS line; upstream-ref eligible but blast-radius > 5000 (openssl is a transitive dep of almost everything) forces human-review-required. kind_reason: blast-radius-exceeds-threshold.",
      "is_example": false
    },
    {
      "cve_id": "CVE-2025-49844",
      "harvested_at": "2026-04-23T00:00:00Z",
      "nixpkgs_rev": "0fe515d3713df4ab8f28cd7bcf9200ebcdee726f",
      "affected_attrs": [
        "redis"
      ],
      "historical_fix": {
        "upstream_repo_url": "https://github.com/redis/redis",
        "upstream_tag_or_release": "8.2.2",
        "nixpkgs_fix_commit_sha": "29d5e4b3a716"
      },
      "axes": {
        "mapping_difficulty": "easy",
        "version_bump_complexity": "multi-release",
        "passthru_tests": "yes",
        "reproducibility": "parser-heavy",
        "rebuild_closure_size": "<50",
        "human_decision_difficulty": "contentious"
      },
      "expected_v0_eligibility": "requires-human-review",
      "expected_bundle_kind": "human-review-required",
      "expected_upstream_ref_verdict": "eligible-requires-human-review",
      "notes": "CWE-416 UAF via Lua scripting leading to RCE (plus 3 co-fixed CVEs). Multi-release 8.0.3->8.2.2 (two minor bumps); compounded by the post-SSPL-relicensing context making this branch a contentious choice for many distros. human_review_trigger: ambiguous-changelog / large-sbom-delta.",
      "is_example": false
    },
    {
      "cve_id": "CVE-2025-61962",
      "harvested_at": "2026-04-23T00:00:00Z",
      "nixpkgs_rev": "49314339f51950017816aac9d50bdd3a5fe430f5",
      "affected_attrs": [
        "fetchmail_7"
      ],
      "historical_fix": {
        "upstream_repo_url": "https://gitlab.com/fetchmail/fetchmail",
        "upstream_tag_or_release": "7.0.0-alpha11",
        "nixpkgs_fix_commit_sha": "3886232a1c7e"
      },
      "axes": {
        "mapping_difficulty": "easy",
        "version_bump_complexity": "multi-release",
        "passthru_tests": "none",
        "reproducibility": "parser-heavy",
        "rebuild_closure_size": "<50",
        "human_decision_difficulty": "contentious"
      },
      "expected_v0_eligibility": "requires-human-review",
      "expected_bundle_kind": "human-review-required",
      "expected_upstream_ref_verdict": "eligible-requires-human-review",